{
  "seq": 0,
  "event_id": "5f2c1a9e8b7d4c3a9e1f0b2c3d4e5f60",
  "event_type": "request",
  "timestamp": "2026-06-16T13:30:00Z",
  "agent_id": "01_intake_nlu",
  "inputs": {
    "raw_request": "Predict the solubility of aspirin in water at 25 C"
  },
  "outputs": {
    "intent_id": "intent-solubility-aspirin-water-25C",
    "objective": "Predict the solubility of aspirin in water at 25 C"
  },
  "input_hash": "b1b2c3d4e5f60718b1b2c3d4e5f60718b1b2c3d4e5f60718b1b2c3d4e5f60718",
  "output_hash": "c1b2c3d4e5f60718c1b2c3d4e5f60718c1b2c3d4e5f60718c1b2c3d4e5f60718",
  "decision_rationale": "Parsed the natural-language request into a structured intent for the solubility pilot.",
  "prev_hash": "",
  "hash": "a1b2c3d4e5f60718a1b2c3d4e5f60718a1b2c3d4e5f60718a1b2c3d4e5f60718"
}
